Value,Category,Synthetic_data
"Переходник — байонет, с фильтром",другая деталь,True
трубопровод от подкачивающего насоса к фильтру,другая деталь,True
 труба от насоса к фильтру,другая деталь,True
 шланг от насоса к фильтру,другая деталь,True
 трубка от насоса к фильтру,другая деталь,True
 линия от насоса к фильтру,другая деталь,True
 трасса от насоса к фильтру,другая деталь,True
 система от насоса к фильтру,другая деталь,True
 магистраль от насоса к фильтру,другая деталь,True
 канал от насоса к фильтру,другая деталь,True
 проводка от насоса к фильтру,другая деталь,True
 Воздушный фильтр с вакуумным приводом и заслонкой,набор деталей,True
 масляный фильтр с картонным элементом,набор деталей,True
 фильтр с штуцером масляного радиатора,набор деталей,True
 масляный фильтр с корпусом и маслоохладителем,набор деталей,True
 фильтр воздушный с креплением,набор деталей,True
 Масляный фильтр для АКПП в комплекте с прокладкой,набор деталей,True
 фильтр трансмиссии с крышкой и уплотнением,набор деталей,True
 фильтр для топлива с колбой.,набор деталей,True
Масляный фильтр с фланцем и радиатором,набор деталей,True
 Масляный фильтр с фланцем и охладителем,набор деталей,True
Сажевый фильтр с нейтрализатором,набор деталей,True
 сажевый фильтр с катализатором,набор деталей,True
Масляный фильтр с фланцем,набор деталей,True
 масляный фильтр с фланцевым соединением,набор деталей,True
 фильтр с прокладкой,набор деталей,True
 фильтр автоматической коробки передач с прокладкой,набор деталей,True
 масляный фильтр в сборе с уплотнением,набор деталей,True
Салонный угольный фильтр с кондиционером,набор деталей,True
 фильтрующая сетка с поплавковым устройством,набор деталей,True
фильтр салона угольный,набор деталей,True
" фильтр для салона автомобиля, 2 штуки",набор деталей,True
Комплект внутренних фильтров очистки воздуха,набор деталей,True
 набор фильтров для кондиционера.,набор деталей,True
Провод с фильтром помех,набор деталей,True
 фильтр помех в комплекте с проводом.,набор деталей,True
 набор элементов масляного фильтра с колпачком,набор деталей,True
Комплект фильтра салона,набор деталей,True
 Набор фильтра салона,набор деталей,True
 фильтрующий набор,набор деталей,True
Комплект фильтров,набор деталей,True
 фильтрующие элементы,набор деталей,True
Комплект фильтра,набор деталей,True
 набор элементов и прокладки масляного фильтра,набор деталей,True
Набор сменных фильтров,набор деталей,True
 Комплект фильтров для замены,набор деталей,True
 набор элементов масляного фильтра,набор деталей,True
Комплект фильтра-воздушного,набор деталей,True
 набор фильтра воздушного,набор деталей,True
Комплект фильтрации масла,набор деталей,True
 набор масляных фильтров.,набор деталей,True
 элемент фильтрации масляный набор,набор деталей,True
Комплект фильтров АКПП,набор деталей,True
 Набор фильтров для АКПП,набор деталей,True
Ремкомплект фильтра автоматической коробки передач,набор деталей,True
 Набор деталей для ремонта фильтра АКПП,набор деталей,True
Ремкомплект фильтра,набор деталей,True
 Набор для ремонта фильтра,набор деталей,True
комплект фильтра салона,набор деталей,True
 набор салонного фильтра,набор деталей,True
комплект деталей для монтажа сажевого фильтра,набор деталей,True
 набор деталей для установки сажевого фильтра,набор деталей,True
Комплект фильтра топлива (вставка),набор деталей,True
 Набор фильтра для топлива (вставка),набор деталей,True
 Комплект для замены поддона АКПП с фильтром BMW/CHRYSLER/JAGUAR/LAND ROVER,набор деталей,True
 набор фильтров,набор деталей,True
 комплект фильтров для воздуха,набор деталей,True
Комплект фильтров для технического обслуживания,набор деталей,True
 Набор фильтров для ТО,набор деталей,True
Набор фильтров,набор деталей,True
 комплект воздушного фильтра,набор деталей,True
Ремонтный комплект фильтра масляного,набор деталей,True
 Набор для ремонта масляного фильтра,набор деталей,True
Комплект воздушного фильтра,набор деталей,True
 набор прокладок для фильтра,набор деталей,True
Комплект фильтров балансировочных валов,набор деталей,True
 набор фильтров для балансировочных валов.,набор деталей,True
 Комплект фильтров воздушных,набор деталей,True
 проводка топливного фильтра,набор деталей,True
 набор угольных фильтров,набор деталей,True
Комплект сменного элемента масляного фильтра,набор деталей,True
 набор для замены масляного фильтра.,набор деталей,True
комплект фильтров,набор деталей,True
Комплект гидрофильтров,набор деталей,True
Набор инструментов для смены масляных фильтров,набор деталей,True
 Комплект ключей для замены масляных фильтров,набор деталей,True
Комплект фильтров для двигателя,набор деталей,True
 набор фильтров для мотора,набор деталей,True
Комплект топливных фильтров,набор деталей,True
 Набор топливных фильтров,набор деталей,True
"Комплект масляный картер, масляного фильтра, мкпп",набор деталей,True
" Набор масляный картер, масляного фильтра, мкпп.",набор деталей,True
Набор уплотнительных колец корпуса масляного фильтра,набор деталей,True
 Набор прокладок для корпуса масляного фильтра,набор деталей,True
Электромагнитный клапан и фильтр,набор деталей,True
 Электромагнитный клапан и фильтрующая система,набор деталей,True
Комплект креплений топливного фильтра,набор деталей,True
 Набор кронштейнов для топливного фильтра,набор деталей,True
" Комплект дооснащения, сажевый / частичный фильтр",набор деталей,True
Ремкомплект топливного фильтра,набор деталей,True
 Набор для ремонта топливного фильтра,набор деталей,True
Комплект фильтра АКПП с прокладкой,набор деталей,True
 набор деталей для фильтрации АКПП с уплотнительным кольцом,набор деталей,True
Комплект масляного фильтра КПП,набор деталей,True
 Набор масляного фильтра коробки передач,набор деталей,True
Комплект прокладок масляного фильтра,набор деталей,True
 набор прокладок для масляного фильтра,набор деталей,True
Комплект фильтра горючего,набор деталей,True
 Комплект фильтра для топлива,набор деталей,True
Комплект модернизации фильтра масла,набор деталей,True
 Набор для обновления масляного фильтра.,набор деталей,True
Ремкомплект топливного фильтра с регулятором давления,набор деталей,True
 Набор для ремонта топливного фильтра с регулятором,набор деталей,True
Комплект прокладок для масляного фильтра,набор деталей,True
 Набор прокладок для масляного фильтра,набор деталей,True
 набор деталей для фильтрации воздуха,набор деталей,True
 набор прокладок и фильтр под форсунку,набор деталей,True
комплект фильтров для салона,набор деталей,True
 набор салонных фильтров,набор деталей,True
Набор салонных фильтров,набор деталей,True
 Комплект фильтров для салона,набор деталей,True
Комплект топливного фильтра,набор деталей,True
 набор топливного фильтра,набор деталей,True
Комплект уплотнителей корпуса масляного фильтра,набор деталей,True
 Набор сальников для корпуса масляного фильтра,набор деталей,True
Ремонтный комплект фильтра влагоотделителя пневмосистемы,набор деталей,True
 Набор для ремонта фильтра влагоотделителя пневмосистемы,набор деталей,True
Комплект прокладок для кронштейна масляного фильтра,набор деталей,True
 Набор прокладок для крепления масляного фильтра,набор деталей,True
Комплект фиксации фильтра воздушного,набор деталей,True
 набор для крепления воздушного фильтра,набор деталей,True
Набор картриджей для фильтрации,набор деталей,True
 Комплект фильтрующих элементов,набор деталей,True
Прокладки для масляного фильтра,набор деталей,True
 Комплект прокладок для масляного фильтра,набор деталей,True
Ремкомплект фильтра коробки передач,набор деталей,True
 Набор для ремонта фильтра АКПП,набор деталей,True
Комплект фильтра для масла,набор деталей,True
 Набор масляного фильтра,набор деталей,True
Комплект масляный поддон с фильтром и прокладкой,набор деталей,True
 набор масляный поддон с фильтром и прокладкой,набор деталей,True
 Масляный радиатор и фильтрующий элемент.,набор деталей,True
 Комплект уплотнений топливного фильтра,набор деталей,True
Комплект уплотнительных колец для топливного фильтра,набор деталей,True
 Набор уплотнительных колец для топливного фильтра,набор деталей,True
 комплект фильтра,набор деталей,True
" Монтажный комплект, сажевый / частичный фильтр",набор деталей,True
Комплект фильтра-осушителя,набор деталей,True
 Набор фильтра осушителя,набор деталей,True
 набор прокладок для масляного фильтра.,набор деталей,True
Ремкомплект воздушного фильтра,набор деталей,True
 Набор для ремонта воздушного фильтра,набор деталей,True
комплект масляных фильтров для технического обслуживания,набор деталей,True
 набор масляных фильтров для ТО,набор деталей,True
 комплект фильтров.,набор деталей,True
Комплект картриджей фильтра масляного,набор деталей,True
 набор картриджей масляного фильтра,набор деталей,True
Комплект фильтра масла для АКПП,набор деталей,True
 Набор фильтра масла для автоматической коробки передач,набор деталей,True
Ремонтный комплект фильтра топливного с регулятором давления,набор деталей,True
Комплект фильтра коробки передач VAG,набор деталей,True
 Набор фильтра АКПП VAG,набор деталей,True
Ремкомплект фильтра АКПП с разъемом,набор деталей,True
 набор деталей для ремонта фильтра АКПП с сальниками,набор деталей,True
Комплект фильтров для камеры,набор деталей,True
 Набор фильтров для объектива,набор деталей,True
Комплект для замены масла: 4 литра + фильтр + кольцо,набор деталей,True
 Набор для смены масла: 4 литра + фильтр + уплотнительное кольцо.,набор деталей,True
 Набор фильтрующих элементов,набор деталей,True
 Комплект фильтров,набор деталей,True
Комплект фильтров колесного тормоза,набор деталей,True
 Набор фильтров для колесных тормозов,набор деталей,True
Прокладки для адаптера масляного фильтра,набор деталей,True
" набор фильтров (воздушного, масляного, салонного)",набор деталей,True
Комплект фильтров кондиционера,набор деталей,True
 Набор фильтров для кондиционера,набор деталей,True
фильтр воздушный набор,набор деталей,True
 комплект фильтров воздушных,набор деталей,True
фильтр салона набор,набор деталей,True
 комплект фильтров салона,набор деталей,True
набор фильтрующих картриджей,набор деталей,True
 фильтрующий комплект,набор деталей,True
Комплект картриджей фильтров,набор деталей,True
 набор фильтрующих элементов.,набор деталей,True
набор фильтров,набор деталей,True
 комплект фильтров,набор деталей,True
 Комплект для ремонта топливного фильтра с регулятором,набор деталей,True
Комплект фильтра масляного,набор деталей,True
 набор фильтра масляного,набор деталей,True
Охладитель радиатор масляный в комплекте с фильтром из бумаги,набор деталей,True
 Охладитель радиатор масляный с фильтром из бумаги.,набор деталей,True
Комплект сетчатого фильтра,набор деталей,True
 набор сетчатого фильтра,набор деталей,True
 гарантийный комплект ферритового фильтра,набор деталей,True
 Масляный фильтр и охлаждающее устройство,набор деталей,True
 фильтрующие элементы салона,набор деталей,True
" Корпус фильтра воздушного верхняя и нижняя часть 1.8, 2.0",набор деталей,True
Комплект прокладок фильтра очистки топлива,набор деталей,True
 набор деталей для фильтрации топлива.,набор деталей,True
Комплект прокладок для топливного фильтра,набор деталей,True
 набор прокладок для топливного фильтра.,набор деталей,True
Поддон автоматической коробки передач и фильтр,набор деталей,True
Комплект фильтра автоматической коробки передач,набор деталей,True
 набор деталей для фильтра АКПП,набор деталей,True
Комплект прокладок корпуса масляного фильтра,набор деталей,True
Ремонтный комплект фильтра масла автоматической коробки передач,набор деталей,True
 Набор деталей для ремонта масляного фильтра АКПП,набор деталей,True
Комплект фильтров для воздуха,набор деталей,True
 Набор воздушных фильтров,набор деталей,True
 набор гидрофильтров,набор деталей,True
 фильтр и комплектующие,набор деталей,True
Топливный насос с фильтром,другая деталь,True
Насос с фильтром,другая деталь,True
Нейтрализатор с сажевым фильтром и средним глушителем,другая деталь,True
 нейтрализатор с сажевым фильтром и глушителем средней величины,другая деталь,True
 нейтрализатор с глушителем средних размеров и сажевым фильтром.,другая деталь,True
 масляный радиатор с фильтром,другая деталь,True
 масляный радиатор с фильтрующим элементом,другая деталь,True
 масляный радиатор с фильтрующей вставкой,другая деталь,True
 масляный радиатор с фильтровальным элементом,другая деталь,True
 труба выпуска отработавших газов с сажевым фильтром и адсорбером.,другая деталь,True
Поддон автоматической коробки передач с фильтром в сборе,другая деталь,True
Поддон АКПП с фильтрующим элементом в сборе,другая деталь,True
Поддон коробки-автомат с фильтром в сборе,другая деталь,True
Поддон автоматической трансмиссии с фильтром в сборе,другая деталь,True
Поддон АКПП с фильтром в комплекте.,другая деталь,True
 Бак топливный в сборе с приемной трубкой с фильтровальным элементом,другая деталь,True
 Бак топливный в сборе с приемной трубкой с фильтрующим элементом,другая деталь,True
 Бак топливный в сборе с приемной трубкой с системой фильтрации.,другая деталь,True
труба отработавших газов с сажевым фильтром,другая деталь,True
Поддон автоматической коробки передач с фильтром,другая деталь,True
Поддон трансмиссии с фильтром,другая деталь,True
Поддон КПП с фильтром,другая деталь,True
Поддон коробки-автомат с фильтром,другая деталь,True
Поддон АКП с фильтром.,другая деталь,True
Масляный поддон с фильтром,другая деталь,True
 Масляный поддон с системой фильтрации,другая деталь,True
 Масляный поддон с фильтрующим элементом.,другая деталь,True
Усилитель привода с воздушным фильтром,другая деталь,True
Усилитель передачи с воздушным фильтром,другая деталь,True
Усилитель тяги с воздушным фильтром,другая деталь,True
Усилитель мощности с воздушным фильтром,другая деталь,True
Усилитель крутящего момента с воздушным фильтром.,другая деталь,True
Топливопровод с фильтром,другая деталь,True
 топливный провод с фильтром,другая деталь,True
 топливопровод с фильтрующим элементом.,другая деталь,True
 Топливный насос с фильтрующим элементом,другая деталь,True
 Масляный поддон с маслофильтром,другая деталь,True
Бензонасос TOYOTA в сборе с фильтрующим элементом,другая деталь,True
Бензонасос TOYOTA в сборе с системой фильтрации,другая деталь,True
Бензонасос TOYOTA в сборе с фильтрационной установкой.,другая деталь,True
Фланец топливного насоса с фильтром,другая деталь,True
Фланец топливного насоса с фильтрующим элементом,другая деталь,True
 крышка вентилятора с фильтрующим элементом,другая деталь,True
 крышка вентилятора с фильтрующей вставкой,другая деталь,True
 крышка вентилятора с фильтрационной системой.,другая деталь,True
Фланец с фильтром,другая деталь,True
 фильтровочный узел.,другая деталь,True
Бачок гидроусилителя руля BMW с фильтром,другая деталь,True
 Бачок гидроусилителя руля BMW с фильтрующим элементом,другая деталь,True
